{"assessmentHash":"sha256:06c0be20148486fd670f9aad55f2216817e8e2bfb6282cda5a3ebd7616b86e56","attestationHash":"sha256:70fc3707e224b96e5a3352cdb3379d97e4ff5372881e44e21e6fe6981bb9e52b","candidateHash":"sha256:c5d16bea3806ff0d10b7e092f8d2240d14d68b9461aeb44c206bf7fcb2fafb90","councilEpochId":"authorization-ledger-v1c-r3-arch-decision-6-epoch-1","decisionRequestId":"authorization-ledger-v1c-r3-arch-decision-6","outputHash":"sha256:f956ed85cd140343eafb8f5c826d26558d855bd34c1bbcf68e1a40d673e7852c","packetHash":"sha256:c697958655139683efd6b87643c126a66a9b2325223eae8cf4aa20ed5b9f9f0c","rationale":"The candidate fully resolves V5's lost-ack retry idempotency defect via durable SQLite-WAL operation journaling and expected-epoch CAS verification while preserving V5's kernel-authenticated privilege boundaries and zero-consumer V1C exit invariant. Residual implementation verification must ensure SQLite BEGIN IMMEDIATE lock timeouts and domain-separated request serialization are strictly tuned across high-concurrency client retries.","seatId":"seat-google","voteValue":"APPROVE"}