{"assessmentHash":"sha256:a2771a623b3c49656c1a5cae8c2681420c1479d16889cac28e132c0b59085abd","attestationHash":"sha256:4d6bb6a850770f18da81d3c046d1d0112091cf136b3d8487dff6694fee2167f7","candidateHash":"sha256:9bc6b4c3c63ffa02563d936557bfaced13e6f6251f7c0084bbd3abc01805a063","councilEpochId":"authorization-ledger-v1c-r3-architecture-v5-epoch-1","decisionRequestId":"authorization-ledger-v1c-r3-arch-decision-5","outputHash":"sha256:639291ba849ef9cbf806087bb220262a8e49e42bd341a6f86c684dd2689901f0","packetHash":"sha256:820f2568d6a4c5ca54150ee3b140722e1138dbd49ed7f2bfe65c5a4035905dec","rationale":"The proposal resolves both prior blocking deficiencies by enforcing safe-integer bounds (0 <= stopEpoch <= 2^53-1) with fail-closed exhaustion in the canonical serializer and schema, while establishing kernel SO_PEERCRED exact-UID authorization against a root-owned policy with strictly zero V1C execution consumers. Residual caveat: runtime deployment must strictly enforce host file permissions on the root-owned UID policy before daemon initialization.","seatId":"seat-google","voteValue":"APPROVE"}