{"assessmentHash":"sha256:1bf143b12a3a8494289e3b6ed6adc3b83e935803d3e219860f7569dfad07d9da","attestationHash":"sha256:852e74db5976336ffab07a3eee12fcd886534fcca0ca7b9c5e7a03c75de3211f","candidateHash":"sha256:1c1de1a428a380d93123237428cb5d12cda915b02713d82bf5ec56d079f38573","councilEpochId":"shadow-council-candidate-gate-reliability-v1-smoke-epoch","decisionRequestId":"shadow-council-candidate-gate-reliability-v1-smoke-decision","outputHash":"sha256:ea6819938f84ceb4b19f4833670199f3e4c796096d9012dfe528f0ad110047d7","packetHash":"sha256:f20e3b3c281d3fa461c474ecda592f09b15274f7ca139e6b7cab8a2acedd975b","rationale":"The candidate strictly satisfies all bounded synthetic gate criteria, specifying a harmless mode with external effects disabled and all requested NO matrix responses. The payload confers no execution, merge, or real-world authority.","seatId":"seat-google","voteValue":"APPROVE"}