{"assessmentHash":"sha256:17ffc26dca3d35869cd3cb23fd8ad36d7702b1171ebfa57c485f7a21588379ec","attestationHash":"sha256:6805fd7fcd73ed5b7d0a70e840fc8b51fee36bdb5b7e047680c8778ae86e4227","candidateHash":"sha256:9bc6b4c3c63ffa02563d936557bfaced13e6f6251f7c0084bbd3abc01805a063","councilEpochId":"authorization-ledger-v1c-r3-architecture-v5-epoch-1","decisionRequestId":"authorization-ledger-v1c-r3-arch-decision-5","outputHash":"sha256:57a3a07e9273e6bcc18b2cfbb13fa1b5dd87eeb4cf4e2a0556c953367116fd0a","packetHash":"sha256:4cb787535d3491d5af2cd5550e062d3fdc24b18157e8f38169fa436840dfce8e","rationale":"Both named blockers are materially fixed: stopEpoch is a 0..2^53-1 SQLite INTEGER with a typeof/bounds CHECK, app-computed safe-integer update in one IMMEDIATE transaction and fail-closed STOP_EPOCH_EXHAUSTED (no BigInt, no old+1, no wraparound); and authorization is exact-UID SO_PEERCRED matching against a root-owned, O_NOFOLLOW/ownership/mode-validated role allowlist with groups explicitly non-authorizing and no model UID path. checkAndConsume remains privileged dormant state with no V1C production consumer or route. Residual caveat: binding grant validity to equality with the current global stopEpoch means any increment mass-invalidates all outstanding grants — acceptable as fail-closed, but the operational intent should be documented at implementation.","seatId":"seat-anthropic","voteValue":"APPROVE"}