{"assessmentHash":"sha256:8e19a11bcad75bf3ca372a281f862190edf2c6d3638cbc73d614e0f761e8db7d","attestationHash":"sha256:f28a2b167b17b6b2638632ef71add93979942ffdbe7d7470e8c60fa25b4c2fbf","candidateHash":"sha256:eb2365a1fb7190138a46705a09f9b94d00836f46df0d16021b9336ede21015bb","councilEpochId":"shadow-council-decision-record-persistence-v1-smoke-epoch","decisionRequestId":"shadow-council-decision-record-persistence-v1-smoke-1","outputHash":"sha256:4a8f470ed1b73f2a2f24ddefc96f91416b49fe9fa6fafe231c02115313fe22d0","packetHash":"sha256:61d687030f40ae8a7f1989da3312b00942c8134d59a85ffa3eeb1f1c7e0541fb","rationale":"The candidate satisfies safety boundaries because it is strictly isolated as a synthetic, no-op smoke test intended solely to validate DecisionRecord persistence tooling without operational or architectural impact. This record must remain strictly bounded to persistence verification and not be cited as authorization for substantive changes.","seatId":"seat-google","voteValue":"APPROVE"}