{"assessmentHash":"sha256:be068b820a82589555d1b402c6319b36105a9bbda2eac4aa40e44121e21c59d3","attestationHash":"sha256:caa387f857d91d01b4394b289c9668b5d8976ca3bd99775587c6e62424c5afaa","candidateHash":"sha256:2aaca3d99983d0b74858e4ab984eb45e597461140018a3fd6a38f4fa840de802","councilEpochId":"epoch-reviewer-reliability-smoke-1","decisionRequestId":"shadow-council-reviewer-reliability-smoke-1","outputHash":"sha256:5f2485a920e266e0590eeae0c32a8df0336365bee3364665f5256808873a1877","packetHash":"sha256:1fe9575017d8bc5c3365c14b0e8c4c8ef8694d183dd4b423b0e63afd5a7174ba","rationale":"The candidate preserves the immutable acceptance boundary while creating substantial provider-neutral headroom, and appropriately treats the V3/V4 failures as evidence consistent with—not proof of—a ceiling-anchoring cause. Its prompt-first approach also avoids decoder caps that could produce truncated or invalid output; the main residual caveat is that the proposed retry should remain a separately evaluated escalation, since it exceeds the stated prompt-text-only scope.","seatId":"seat-openai","voteValue":"APPROVE"}