{"assessmentHash":"sha256:6f8556483757ac1f208f975d63b8d91f4859c5f0ecab1f9079f18395d0b3e25b","attestationHash":"sha256:9ea7aabd1a0bf849e0573538f8535a64bbc996385b8966712530eb16d2b9433a","candidateHash":"sha256:8a4710dc1b3fe1b5161ae25d5fdb0a299df553c2f33a2eb896e05a2c2c905cbe","councilEpochId":"shadow-council-vote-rationale-smoke-epoch-1","decisionRequestId":"shadow-vote-rationale-smoke-1","outputHash":"sha256:6bdf404d28912c2d3f4fca8ac0f963e2db4f55614c1a41bbb4af9f9ffe0c7605","packetHash":"sha256:812e9ca9fa506d212f9fa96b8d44852293e166e1945731fb5e5f01a03a767d04","rationale":"Candidate is well-formed against the vote-response contract: payload carries both required fields (voteValue, rationale), the summary matches the payload's voteValue, and the rationale is non-empty, on-topic, and within length limits. The substantive position (sentence-case headings) is defensible and internally consistent — consistency of application and reduced capitalization ambiguity are legitimate style-guide grounds, and no contradicting evidence is present. Risk class R1 with advisory-only scope means no real MIHVER document, merge, or repository action is affected, so approval carries no material downside. No missing or extraneous fields, no hash/ordinal irregularities observed.","seatId":"seat-anthropic","voteValue":"APPROVE"}