{"assessmentHash":"sha256:8f1e39abb59756d4b9840f955e5d8c4b47f35d0934cd247735c0c65251f695bf","attestationHash":"sha256:acccc464b7961d3eb0182cae51886ef31eeacb1e29b30cfcd78ed830ad871d77","candidateHash":"sha256:c072d9969bede46ebfd3ab336d50ef97065a4ff08c6f17f42fe062c74671f0f8","councilEpochId":"authorization-ledger-v1c-r3-arch-decision-7-epoch-1","decisionRequestId":"authorization-ledger-v1c-r3-arch-decision-7","outputHash":"sha256:9d74a8ee3040ec7c7f98250383167338a0da8aebcd317d25b8c2325243551724","packetHash":"sha256:3d1c37c1998954a24700dd0f081ba00e576c990e46d87188c47e9714753936cf","rationale":"The candidate satisfies the decisive V7 requirement: yesNoMatrix contains exactly 17 separately represented Q01–Q17 entries, including all distinct Claude/Codex pairs, with verbatim questions and NO answers. It also faithfully preserves decision-6’s privilege boundaries, atomic retry-safe stopEpoch protocol, exact-bound grants, dormant consume-once state, and zero V1C execution-effect consumers.","seatId":"seat-openai","voteValue":"APPROVE"}