{"assessmentHash":"sha256:f424eb6aae24eaba98914f028356a3b6c6279d522eaf157daa8fb446779ef363","attestationHash":"sha256:f697424863b420d97b8ecc377d6734ee3ab1e516bb9022ed132f44c8dbb5d7e1","candidateHash":"sha256:2aaca3d99983d0b74858e4ab984eb45e597461140018a3fd6a38f4fa840de802","councilEpochId":"epoch-reviewer-reliability-smoke-1","decisionRequestId":"shadow-council-reviewer-reliability-smoke-1","outputHash":"sha256:6bf2425e2b9b65657ad72c598b41cbc04b7d3bb1827eea53baab5898bde516e8","packetHash":"sha256:0b7ef264b65a903d5254ae45e874fcc0aa138e709104a92686c1e379b4ebe82f","rationale":"The proposal effectively mitigates first-call character overflow by establishing a 500/600-character soft generation budget with 2x headroom while keeping the 1200-character acceptance ceiling and provider neutrality intact. The primary residual caveat is ensuring the dual numbers are centrally referenced to prevent template maintenance drift.","seatId":"seat-google","voteValue":"APPROVE"}