{"assessmentHash":"sha256:75c31f679df71717c216fd7d1ce5d57acaac1d5d4805c15e0145b9c1a22c6c3f","attestationHash":"sha256:be078ad59eca795b5b7d3360f60941d63419093631d07838bbf146888941d7c6","candidateHash":"sha256:c072d9969bede46ebfd3ab336d50ef97065a4ff08c6f17f42fe062c74671f0f8","councilEpochId":"authorization-ledger-v1c-r3-arch-decision-7-epoch-1","decisionRequestId":"authorization-ledger-v1c-r3-arch-decision-7","outputHash":"sha256:dcc4dc22439224407c6f24429147b5b274b108d5cd97047ba4a3d0ad645c67f1","packetHash":"sha256:c23bc1a1017f4d3c12ec6157254e3f893eb09ca058e9cb00aa89b0d7db901c1b","rationale":"The sole required revision is met: yesNoMatrix is an array of exactly 17 objects, Q01..Q17 in ascending order, each with only id/question/answer, questions byte-verbatim per evidence 2-4 (including separate CLAUDE/CODEX entries at Q01/Q02, Q03/Q04, Q08/Q09), all answers NO. Decision-6's architecture is reproduced without redesign, and every required payload field is present and concrete: exact increment transaction, journal unique key, domain-separated requestHash, both lost-ack traces with the deciding stored field named, all six concurrency/crash cases, Option A lookup, and an unqualified zero-production-consumer/no-Execution-Gateway gate. Residual caveat: consume-once duplicate handling is described only as serializing on the unique consume key without naming the stored record field returned, a documentation-level gap that does not reopen a trust boundary.","seatId":"seat-anthropic","voteValue":"APPROVE"}