{"assessmentHash":"sha256:f2678e22ac10ee93dd34ae75544218fc2fc5ba813d69fbde0cc453463b14d4b3","attestationHash":"sha256:432039c6ef195b0dca8ee01287183f80c005ece39576516241fbece09cbcf62f","candidateHash":"sha256:0e63ea1a26d081ddc64197df8a37cd7f7f20cfd0f284152da151a0151246175c","councilEpochId":"authorization-ledger-v1c-r3-architecture-v4-epoch-1","decisionRequestId":"authorization-ledger-v1c-r3-arch-decision-4","outputHash":"sha256:79ce2e1997eb17e3225fb140cdbdca67af3804bbcb25f297e6d85c00be50b3ba","packetHash":"sha256:c10bcffa2bc9d624dc0ab57e7a91e76bafa94b8ee519f71921a930b8ff9e22d6","rationale":"The architecture is close, but two implementation-critical ambiguities prevent approval. First, stopEpoch is specified as an unsigned 64-bit SQLite value with SQL old+1 arithmetic, yet SQLite INTEGER is signed 64-bit; the schema, encoding, comparison, guarded increment, and actual maximum are therefore not implementable exactly as written. Second, SO_PEERCRED supplies the peer’s effective UID/GID, not a complete supplementary-group authorization set; merely naming privileged Unix groups does not define a mechanically reliable per-RPC membership check for typical human accounts. Specify a signed nonnegative range or fixed-width encoding with exact increment semantics, and define authorization through dedicated effective-GID processes, UID allowlists, or verified /proc peer groups. The zero-effect-consumer and fail-closed persistence boundaries otherwise satisfy the decisive V1C requirements.","seatId":"seat-openai","voteValue":"REJECT"}