{"assessmentHash":"sha256:931f05fffbbfa3c57a2633e3f8d4570de2f1db2af6c3efae2112418ec6b88632","attestationHash":"sha256:de036f5c6be2ae79821105a5bb9befe0bc9c3dd0a47670382da6e5d77cfa3857","candidateHash":"sha256:2aaca3d99983d0b74858e4ab984eb45e597461140018a3fd6a38f4fa840de802","councilEpochId":"epoch-reviewer-reliability-smoke-1","decisionRequestId":"shadow-council-reviewer-reliability-smoke-1","outputHash":"sha256:98807344bded204810561a5fac06cd272353ae6286a2def4c61c3b76a6021832","packetHash":"sha256:33914ad6abe577e3c2c1b84aac61002fc98b189f2215bee283c830617dae6df9","rationale":"Approve: the candidate resolves all five sub-questions inside the advisory boundary, leaves the 1200-character ceiling parser-enforced and untouched, and its (e) reasoning is decisive — a decoder-level token clamp would trade a soft overshoot for mid-sentence truncation and invalid JSON, so prompt budget plus a validation-triggered reprompt is the right escalation. It also declines to overclaim V3/V4 causation. Caveat: the summary calls the 600 budget 'strictly lower' when it is lower than the ceiling, not the 500 target; tighten that wording before it is copied into packet prose.","seatId":"seat-anthropic","voteValue":"APPROVE"}