{"assessmentHash":"sha256:edfc89b09bd40bb69bbd779bc28fdb7806d98c9ffa72cf2d2b52aa6c454fda35","attestationHash":"sha256:ca634e1a5e16568a63c52e3a2fd16b648cdc46f22461e199845808945d282c88","candidateHash":"sha256:8a4710dc1b3fe1b5161ae25d5fdb0a299df553c2f33a2eb896e05a2c2c905cbe","councilEpochId":"shadow-council-vote-rationale-smoke-epoch-1","decisionRequestId":"shadow-vote-rationale-smoke-1","outputHash":"sha256:450cac2a28ce0f628d066603b5672af2d314458802cacd35c4a2331c1405a6ee","packetHash":"sha256:b0219a3bd9c89d65240ea5335b01c00a17e89b9e1ee9752d9eb53032f8f2173f","rationale":"The candidate is internally coherent and appropriately scoped to the harmless smoke test. Its stated preference for sentence-case headings is supported by concise, relevant grounds: consistency, natural readability, and reduced capitalization ambiguity.","seatId":"seat-openai","voteValue":"APPROVE"}