{"assessmentHash":"sha256:04eb6e85fedba8da7504a1e2b36035622630b37e803602aac06b154a0308e4ea","attestationHash":"sha256:29ec3724aaf7adbd5ecd6fb124f1ec4c39e8a428bd1c61330c1f68a74c96882a","candidateHash":"sha256:c5d16bea3806ff0d10b7e092f8d2240d14d68b9461aeb44c206bf7fcb2fafb90","councilEpochId":"authorization-ledger-v1c-r3-arch-decision-6-epoch-1","decisionRequestId":"authorization-ledger-v1c-r3-arch-decision-6","outputHash":"sha256:11925b1ed5ac9d6f3607cc0bbe61ee1cd79bbadb7040cd79b010d8eee976d329","packetHash":"sha256:9412cc37c29638b654903204116e8ccd64f554df9e2b6dc4f8afa21e30520365","rationale":"Decisive: the V5 blocker is materially fixed — a durable privileged journal keyed (peer UID, operationKind, adminOperationId) with a domain-separated requestHash, written in the same BEGIN IMMEDIATE transaction as the epoch write and audit append, combined with the expected-epoch CAS, yields both required lost-ack outcomes (replay of N+1 for trace A, STALE_EXPECTED_STOP_EPOCH for trace B) with no path to N+2; baseline, safe-integer domain, and zero-consumer boundary are preserved. Residual caveat: the matrix collapses the three distinct 'CAN CODEX?' questions into one key (all NO), and the admin socket owner root:mihver-admin sits awkwardly with a daemon running as mihver-ledger — both cosmetic, not trust-boundary defects.","seatId":"seat-anthropic","voteValue":"APPROVE"}