{"assessmentHash":"sha256:03b83f03e14706398399569f348d6c20425f4442f0cb12b5e9f777ce1be2f68b","attestationHash":"sha256:2765cc39b09b40fbbefddcc2bec75674aa8e751e51370cc1ba45cd0ef9ac42e6","candidateHash":"sha256:69224bbf74832529b8275c7cd1a51e045147a4793c594ed2e49195c0141a0507","councilEpochId":"contemporaneous-quorum-evidence-v1-smoke-epoch","decisionRequestId":"contemporaneous-quorum-evidence-v1-smoke-r2","outputHash":"sha256:39ccc64091fb5cdfe5eaabbd2497f2662bfa32893fe97aa3d5e3acb6e1a91e0f","packetHash":"sha256:834667d55a94e2e74d422bb5affe699edbcf54e099872e0d2c6d7112f8993665","rationale":"The proposal directly resolves contributor onboarding friction and environment drift supported by the evidence, remaining safely scoped to developer documentation practices. Maintainers should ensure documented version requirements remain synchronized with subsequent CI configuration updates.","seatId":"seat-google","voteValue":"APPROVE"}