{"assessmentHash":"sha256:a87e6ca9b996827a606dc4f1769977d37b921d550be001cbec833891923d0c5d","attestationHash":"sha256:3e49439b4cc78218371a1b792dd877bc7c9298d45201fe2630e9ce482b227a64","candidateHash":"sha256:eb2365a1fb7190138a46705a09f9b94d00836f46df0d16021b9336ede21015bb","councilEpochId":"shadow-council-decision-record-persistence-v1-smoke-epoch","decisionRequestId":"shadow-council-decision-record-persistence-v1-smoke-1","outputHash":"sha256:a565910da8a84f265aa44e1526be6a282ab7932231ccdd0aabefe0a2874db6f6","packetHash":"sha256:bac8689ece0006e871c41c071e35565e2388b58e97c7ad616c103a858d51eef0","rationale":"The candidate is bounded to a documentation-only, no-op effect with an explicit condition disclaiming any real architecture or authorization force, so approving it changes no system state and stays within R2 tolerance while exercising DecisionRecord persistence. Residual caveat: the persisted record must remain clearly tagged as synthetic so it is never cited as precedent for future decisions.","seatId":"seat-anthropic","voteValue":"APPROVE"}