{"assessmentHash":"sha256:5588016a34f0ee1cae4881d651b5b70ca6d297e71876bbbe242f85abb3ef7d1e","attestationHash":"sha256:81249b2a165f5447ce1f4b4ed92bc101b6b7f955182a027e62f2d2855f1a56a3","candidateHash":"sha256:c5d16bea3806ff0d10b7e092f8d2240d14d68b9461aeb44c206bf7fcb2fafb90","councilEpochId":"authorization-ledger-v1c-r3-arch-decision-6-epoch-1","decisionRequestId":"authorization-ledger-v1c-r3-arch-decision-6","outputHash":"sha256:568312145175aff52d63dd2603aa650193989dcc9ab4b92fd4cfca004519233a","packetHash":"sha256:f1f854db7f6dc7b891e0c7fa8741ddd87aa287d66612484e2dca4a012dc71bee","rationale":"The required YES/NO matrix is incomplete: a single ambiguous “CAN CODEX?” field does not explicitly answer the three distinct required questions concerning grant issuance, ADMIN UID-policy modification, and stopEpoch increment. Evidence item 15 requires every question to be answered explicitly.","seatId":"seat-openai","voteValue":"REJECT"}