{"assessmentHash":"sha256:3adc5d71596010490184c92f270c15679babb590c1a97929744f08811e29bfd2","attestationHash":"sha256:9b9f28e78f271f140844caf8e2379a268e5f1ca7adbc274af4544447f377c995","candidateHash":"sha256:c072d9969bede46ebfd3ab336d50ef97065a4ff08c6f17f42fe062c74671f0f8","councilEpochId":"authorization-ledger-v1c-r3-arch-decision-7-epoch-1","decisionRequestId":"authorization-ledger-v1c-r3-arch-decision-7","outputHash":"sha256:2939b3aaa9c4024f716765ec90a56100612849d235c001277ee4f017644b2155","packetHash":"sha256:aca2357477eb993bc1740455a348847c585762546a2085f4c4d3eb9e29ec5d64","rationale":"The proposal fully satisfies the V1C privilege-separation boundary by faithfully preserving the Decision-6 architecture while correcting the mandatory verification matrix to an exact, uncollapsed 17-item structure. The dual-layer idempotency design combining durable journal replay and expected-epoch CAS guarantees deterministic, crash-resilient stopEpoch state management while strictly ensuring zero execution-effect consumers.","seatId":"seat-google","voteValue":"APPROVE"}