{"assessmentHash":"sha256:ba5509e33455c0510eeff1a50c6cf164dd74726b929f68078ed3458f6219f75c","attestationHash":"sha256:50088417bc0df3d0d75594e6a9bdf3bcb02e465032be33ea26efdddb278f0a27","candidateHash":"sha256:1c1de1a428a380d93123237428cb5d12cda915b02713d82bf5ec56d079f38573","councilEpochId":"shadow-council-candidate-gate-reliability-v1-smoke-epoch","decisionRequestId":"shadow-council-candidate-gate-reliability-v1-smoke-decision","outputHash":"sha256:099ec12a3a9c0ebfe69596de84990b5e9b61f4b0c32e6b5470d2de901358faf2","packetHash":"sha256:1f7fbe1a296f8cb9405abdb25718344de057b7c49e1a9012de1123fa6c3e373f","rationale":"Payload matches every hard-gate field exactly: exercise literal, mode HARMLESS, externalEffectAllowed false, and ordered unique matrix ids S01/S02 both answering NO. Scope is a synthetic tooling smoke granting no execution, publication, merge, or authorization authority, so no external effect follows from approval.","seatId":"seat-anthropic","voteValue":"APPROVE"}