{"assessmentHash":"sha256:8b320b2aecbfc9e063ba3cb9c0d9f20894c19c97ab03536b32de36f2dc637b8a","attestationHash":"sha256:c2f981160f46bcb1328b126122649379f656764f39ffaf1e9e7d6b7dcbeb8585","candidateHash":"sha256:540531293d50ea6e6f6128203481ea309e077491950578eb3bf543cff5b6e9f3","councilEpochId":"authorization-ledger-v1c-r3-architecture-v3-epoch-1","decisionRequestId":"authorization-ledger-v1c-r3-arch-decision-3","outputHash":"sha256:a1aea959205ded1376b49b9fa0cf0ce758d306213f043c9c300bd594f04b3704","packetHash":"sha256:b01e909b2f3b14b589c54ebad1c1924125b7a5c81a8eab693680efa586500eba","rationale":"The candidate contradicts the required zero execution-effect consumers: it explicitly states that downstream execution tiers consume V1C roots and receipts, creating execution-consumer dependencies despite declaring none. Its asynchronous pull model also cannot guarantee that a stopEpoch increment “instantaneously” invalidates grants across downstream checks; stale, partitioned, or compromised consumers may continue acting without a freshness protocol or fail-closed rule. The stop register lacks a defined linearizable authority, persistence/rollback protection, and transaction ordering relative to ledger commits. Privilege separation is further weakened by combining ledger verification, R3 grant administration, import validation, and emergency-stop authority inside one broadly described enclave, while key roles, interfaces, quorum rules, and failure modes remain unspecified. Thus the proposal is neither internally consistent nor exact enough to establish the requested guarantees.","seatId":"seat-openai","voteValue":"REJECT"}