{"assessmentHash":"sha256:c0eb799a6599add84798930d8f9dda68e40cb03294edb5edc40255f1d1418b07","attestationHash":"sha256:379d3ea7d92231f34b14d6a691744b2f6d047c9999329b33291a21acd2865850","candidateHash":"sha256:69224bbf74832529b8275c7cd1a51e045147a4793c594ed2e49195c0141a0507","councilEpochId":"contemporaneous-quorum-evidence-v1-smoke-epoch","decisionRequestId":"contemporaneous-quorum-evidence-v1-smoke-r2","outputHash":"sha256:05a1ec11e68a6571e9b6fa3d66c0d3c9198c857086ac6d8efd535ee70d0e438b","packetHash":"sha256:2205c2013552075f263e3a15da242c454032969fec14c8b750e82e47654c2c0d","rationale":"The recommendation follows directly from the stated evidence: the version is currently discoverable only via CI config, and documenting it explicitly addresses that onboarding and drift gap. Scope is correctly bounded to documentation practice with no MIHVER architecture coupling. Residual caveat: the proposal does not name the target file or a mechanism (e.g. .nvmrc/engines field) to keep the documented version in sync with CI, so drift between the two remains possible.","seatId":"seat-anthropic","voteValue":"APPROVE"}