{"assessmentHash":"sha256:e2647c0a9ce1e2e0b456eb91fc494d153d5631322aad13074fec852ac373d46f","attestationHash":"sha256:e5fd9d1a208c53d29789682583e310965d5032f4c4535c4b2a848644353399c6","candidateHash":"sha256:9bc6b4c3c63ffa02563d936557bfaced13e6f6251f7c0084bbd3abc01805a063","councilEpochId":"authorization-ledger-v1c-r3-architecture-v5-epoch-1","decisionRequestId":"authorization-ledger-v1c-r3-arch-decision-5","outputHash":"sha256:9a4e521a5c1e969211317c974de354d7371e77be86f12f975acf4f51a2495e17","packetHash":"sha256:0b15f909e6623f0a108824093faa90021ede676f86375e3b79d44156d7067a38","rationale":"The candidate materially fixes both prior blockers: stopEpoch is losslessly bounded to the frozen JSON/JS safe-integer domain with enforced exhaustion behavior, and every privileged RPC uses kernel-authenticated UID authorization against a root-owned, fail-closed role allowlist rather than peer groups. It also establishes mechanically enforceable ADMIN/CLIENT separation and leaves grant consumption entirely dormant, with no V1C execution-effect route.","seatId":"seat-openai","voteValue":"APPROVE"}