{"assessmentHash":"sha256:9a70e7ecad4e6d1e08e24cdbdbf7afa3e58bfda87f11c206578ae0ca6b4cd7ff","attestationHash":"sha256:4f35b6125de3827088728e4e5c68c8aba06aaaa60e24b76e9a1bf48957bb10d5","candidateHash":"sha256:8a4710dc1b3fe1b5161ae25d5fdb0a299df553c2f33a2eb896e05a2c2c905cbe","councilEpochId":"shadow-council-vote-rationale-smoke-epoch-1","decisionRequestId":"shadow-vote-rationale-smoke-1","outputHash":"sha256:a36c89dfb4db66898fb8bcd120be488ac7936e6505c7e831a3e24bb5637abdba","packetHash":"sha256:aa7be6752d05adf3cc4d5a3162d0982f43c5e47e84e856e039d19b3bde4fb287","rationale":"The frozen candidate conforms to the synthetic smoke test contract schema, properly populates the required payload fields with a clear rationale, and poses zero operational or repository risk.","seatId":"seat-google","voteValue":"APPROVE"}